{
  "$schema": "https://json-schema.org/draft/2020-12/schema",
  "$id": "https://truchas.org/schema/flow_2d.schema.json",
  "title": "Truchas 2D flow simulation input",
  "description": "Complete input for a standalone two-dimensional incompressible flow simulation.",
  "type": "object",
  "properties": {
    "materials": {
      "$ref": "../../materials/materials.schema.json",
      "description": "Named material definitions used by the simulation. Without material-regions, define exactly one material."
    },
    "material-regions": {
      "$ref": "../../materials/material_regions.schema.json",
      "description": "Optional geometric or cell-set assignment of materials to the mesh."
    },
    "mesh": {
      "$ref": "../../mesh/mesh_2d.schema.json",
      "description": "Two-dimensional mesh definition."
    },
    "flow-model": {
      "$ref": "../../physics/flow/flow_model.schema.json",
      "description": "Incompressible flow model and boundary conditions."
    },
    "flow-solver": {
      "$ref": "../../physics/flow/flow_solver.schema.json",
      "description": "Flow time-stepping, volume-tracking, and linear-solver controls."
    },
    "initial-velocity": {
      "$ref": "../../core/vector_func.schema.json",
      "description": "Optional initial velocity field. It may be a constant vector or an inline vector function, but it must evaluate to exactly two components; if omitted, the initial velocity is zero."
    },
    "sim-control": {
      "$ref": "../../core/sim_control.schema.json",
      "description": "Time-step controls and output schedule."
    }
  },
  "required": [
    "materials",
    "mesh",
    "flow-model",
    "flow-solver",
    "sim-control"
  ],
  "additionalProperties": false,
  "allOf": [
    {
      "if": {
        "not": { "required": ["material-regions"] }
      },
      "then": {
        "properties": {
          "materials": {
            "maxProperties": 1
          }
        }
      }
    },
    {
      "if": {
        "properties": {
          "flow-model": {
            "properties": {
              "inviscid": { "const": true }
            },
            "required": ["inviscid"]
          }
        },
        "required": ["flow-model"]
      },
      "else": {
        "properties": {
          "flow-solver": {
            "required": ["momentum-solver"]
          }
        }
      }
    }
  ]
}
