{
    "materials": {
        "fluid": {"properties": {"fluid": true, "density": 1.0, "viscosity": 1.0}}
    },
    "mesh": {
        "x-axis": {"coarse-grid": [0.0, 1.0], "intervals": [16]},
        "y-axis": {"coarse-grid": [0.0, 1.0], "intervals": [16]},
        "rotation-angle": 30.0
    },
    "flow-model": {
        "bc": {
            "inlet": {
                "type": "velocity",
                "face-set-ids": [1],
                "velocity": {
                    "type": "tabular",
                    "tabular-x": [0.0, 0.8660254037844386],
                    "tabular-y": [[0.0, 0.0], [0.8660254037844386, 0.5]],
                    "tabular-arg": 3
                }
            },
            "outlet": {"type": "pressure", "face-set-ids": [2], "pressure": 0.0},
            "bottom": {"type": "no-slip", "face-set-ids": [3]},
            "top": {"type": "velocity", "face-set-ids": [4], "velocity": [0.8660254037844386, 0.5]}
        }
    },
    "initial-velocity": {
        "type": "polynomial",
        "poly-coef": [[-0.4330127018922193, -0.25], [0.75, 0.4330127018922193]],
        "poly-powers": [[1, 0], [0, 1]]
    },
    "flow-solver": {
        "courant-number": 0.5,
        "volume-tracking": {"algorithm": "simple"},
        "momentum-solver": {"rel-tol": 1.0e-10, "max-ds-iter": 100, "max-amg-iter": 100},
        "projection-solver": {"rel-tol": 1.0e-10, "max-ds-iter": 100, "max-amg-iter": 100}
    },
    "sim-control": {
        "initial-time": 0.0,
        "initial-time-step": 0.05,
        "min-time-step": 1.0e-6,
        "max-time-step": 0.05,
        "time-step-growth": 1.0,
        "output-times": {"times": [0.0, 50.0] }
    }
}
