{
    "materials": {
        "fluid": {"properties": {"fluid": true, "density": 1.0, "viscosity": 0.01}}
    },
    "mesh": {
        "x-axis": {"coarse-grid": [0.0, 1.0], "intervals": [32]},
        "y-axis": {"coarse-grid": [0.0, 1.0], "intervals": [32]}
    },
    "flow-model": {
        "bc": {
            "lid": {"type": "velocity", "face-set-ids": [4], "velocity": [1.0, 0.0]},
            "walls": {"type": "no-slip", "face-set-ids": [1, 2, 3]}
        }
    },
    "flow-solver": {
        "volume-tracking": {"algorithm": "simple"},
        "momentum-solver": {"rel-tol": 1.0e-10, "max-ds-iter": 100, "max-amg-iter": 100},
        "projection-solver": {"rel-tol": 1.0e-10, "max-ds-iter": 100, "max-amg-iter": 100}
    },
    "initial-velocity": [0.0, 0.0],
    "sim-control": {
        "initial-time": 0.0,
        "initial-time-step": 0.005,
        "min-time-step": 1.0e-6,
        "max-time-step": 0.005,
        "time-step-growth": 1.05,
        "courant-number": 0.5,
        "output-times": [0.053, 0.1]
    }
}
